{"$id":"https://closy.local/schemas/v1/closy-garment-pattern-panels,-curves,-seams,-and-openings.schema.json","$schema":"https://json-schema.org/draft/2020-12/schema","additionalProperties":false,"properties":{"garmentClass":{"const":"tshirt"},"openings":{"items":{"type":"object"},"type":"array"},"panels":{"items":{"type":"object"},"type":"array"},"parameters":{"additionalProperties":{"type":"number"},"type":"object"},"provenance":{"type":"object"},"schemaVersion":{"const":1},"seams":{"items":{"type":"object"},"type":"array"}},"required":["schemaVersion","garmentClass","parameters","panels","seams","openings"],"title":"Closy garment pattern panels, curves, seams, and openings","type":"object"}
