{"garmentClass":"tshirt","openings":[{"boundaryEdges":["edge.neck_band.long.top"],"id":"opening.neck","status":"open"},{"boundaryEdges":["edge.cuff.left"],"id":"opening.cuff.left","status":"open"},{"boundaryEdges":["edge.cuff.right"],"id":"opening.cuff.right","status":"open"},{"boundaryEdges":["edge.hem.front","edge.hem.back"],"id":"opening.hem","status":"open"}],"panels":[{"boundary":[{"curve":{"points":[[-0.265,0.0],[0.265,0.0]],"type":"line"},"id":"edge.hem.front","sampleCount":9},{"curve":{"points":[[0.265,0.0],[0.265,0.32969353]],"type":"line"},"id":"edge.side.right.front","sampleCount":6},{"curve":{"points":[[0.265,0.32969353],[0.265,0.45969352999999996],[0.35,0.4696935299999999],[0.35,0.49969352999999994]],"type":"cubic_bezier"},"id":"edge.armhole.right.front","sampleCount":5},{"curve":{"points":[[0.35,0.49969352999999994],[0.06,0.53469353]],"type":"line"},"id":"edge.shoulder.right.front","sampleCount":5},{"curve":{"points":[[0.06,0.53469353],[0.0,0.44969352999999995],[-0.06,0.53469353]],"type":"quadratic_bezier"},"id":"edge.neck.front","sampleCount":5},{"curve":{"points":[[-0.06,0.53469353],[-0.35,0.49969352999999994]],"type":"line"},"id":"edge.shoulder.left.front","sampleCount":5},{"curve":{"points":[[-0.35,0.49969352999999994],[-0.35,0.4696935299999999],[-0.265,0.45969352999999996],[-0.265,0.32969353]],"type":"cubic_bezier"},"id":"edge.armhole.left.front","sampleCount":5},{"curve":{"points":[[-0.265,0.32969353],[-0.265,0.0]],"type":"line"},"id":"edge.side.left.front","sampleCount":6}],"confidence":{"source":"authored_deterministic_fixture","value":1.0},"coordinateSystem":"panel-local-metres","grainDirection":[0.0,1.0],"id":"panel.front","materialRegion":"material.cotton_jersey_reference_v1","seamAllowance":0.025,"semanticRole":"front_torso","symmetry":"panel.back","tessellation":{"targetEdgeLength":0.075}},{"boundary":[{"curve":{"points":[[-0.265,0.0],[0.265,0.0]],"type":"line"},"id":"edge.hem.back","sampleCount":9},{"curve":{"points":[[0.265,0.0],[0.265,0.32969353]],"type":"line"},"id":"edge.side.right.back","sampleCount":6},{"curve":{"points":[[0.265,0.32969353],[0.265,0.45969352999999996],[0.35,0.4696935299999999],[0.35,0.49969352999999994]],"type":"cubic_bezier"},"id":"edge.armhole.right.back","sampleCount":5},{"curve":{"points":[[0.35,0.49969352999999994],[0.06,0.53469353]],"type":"line"},"id":"edge.shoulder.right.back","sampleCount":5},{"curve":{"points":[[0.06,0.53469353],[0.0,0.49969352999999994],[-0.06,0.53469353]],"type":"quadratic_bezier"},"id":"edge.neck.back","sampleCount":5},{"curve":{"points":[[-0.06,0.53469353],[-0.35,0.49969352999999994]],"type":"line"},"id":"edge.shoulder.left.back","sampleCount":5},{"curve":{"points":[[-0.35,0.49969352999999994],[-0.35,0.4696935299999999],[-0.265,0.45969352999999996],[-0.265,0.32969353]],"type":"cubic_bezier"},"id":"edge.armhole.left.back","sampleCount":5},{"curve":{"points":[[-0.265,0.32969353],[-0.265,0.0]],"type":"line"},"id":"edge.side.left.back","sampleCount":6}],"confidence":{"source":"authored_deterministic_fixture","value":1.0},"coordinateSystem":"panel-local-metres","grainDirection":[0.0,1.0],"id":"panel.back","materialRegion":"material.cotton_jersey_reference_v1","seamAllowance":0.025,"semanticRole":"back_torso","symmetry":"panel.front","tessellation":{"targetEdgeLength":0.075}},{"boundary":[{"curve":{"points":[[-0.09,0.0],[0.09,0.0]],"type":"line"},"id":"edge.cuff.left","sampleCount":4},{"curve":{"points":[[0.09,0.0],[0.1271,0.14]],"type":"line"},"id":"edge.sleeve_underarm.right.left","sampleCount":3},{"curve":{"points":[[0.1271,0.14],[0.0,0.245],[-0.1271,0.14]],"type":"quadratic_bezier"},"id":"edge.sleeve_cap.left","sampleCount":5},{"curve":{"points":[[-0.1271,0.14],[-0.09,0.0]],"type":"line"},"id":"edge.sleeve_underarm.left.left","sampleCount":3}],"confidence":{"source":"authored_deterministic_fixture","value":1.0},"coordinateSystem":"panel-local-metres","grainDirection":[0.0,1.0],"id":"panel.sleeve.left","materialRegion":"material.cotton_jersey_reference_v1","seamAllowance":0.025,"semanticRole":"left_sleeve","symmetry":"panel.sleeve.right","tessellation":{"targetEdgeLength":0.075}},{"boundary":[{"curve":{"points":[[-0.09,0.0],[0.09,0.0]],"type":"line"},"id":"edge.cuff.right","sampleCount":4},{"curve":{"points":[[0.09,0.0],[0.1271,0.14]],"type":"line"},"id":"edge.sleeve_underarm.right.right","sampleCount":3},{"curve":{"points":[[0.1271,0.14],[0.0,0.245],[-0.1271,0.14]],"type":"quadratic_bezier"},"id":"edge.sleeve_cap.right","sampleCount":5},{"curve":{"points":[[-0.1271,0.14],[-0.09,0.0]],"type":"line"},"id":"edge.sleeve_underarm.left.right","sampleCount":3}],"confidence":{"source":"authored_deterministic_fixture","value":1.0},"coordinateSystem":"panel-local-metres","grainDirection":[0.0,1.0],"id":"panel.sleeve.right","materialRegion":"material.cotton_jersey_reference_v1","seamAllowance":0.025,"semanticRole":"right_sleeve","symmetry":"panel.sleeve.left","tessellation":{"targetEdgeLength":0.075}},{"boundary":[{"curve":{"points":[[0.0,0.0],[0.6936636579126264,0.0]],"type":"line"},"id":"edge.neck_band.long.bottom","sampleCount":11},{"curve":{"points":[[0.6936636579126264,0.0],[0.6936636579126264,0.035]],"type":"line"},"id":"edge.neck_band.short.right","sampleCount":3},{"curve":{"points":[[0.6936636579126264,0.035],[0.0,0.035]],"type":"line"},"id":"edge.neck_band.long.top","sampleCount":11},{"curve":{"points":[[0.0,0.035],[0.0,0.0]],"type":"line"},"id":"edge.neck_band.short.left","sampleCount":3}],"confidence":{"source":"authored_deterministic_fixture","value":1.0},"coordinateSystem":"panel-local-metres","grainDirection":[1.0,0.0],"id":"panel.neck_band","materialRegion":"material.cotton_rib_reference_v1","seamAllowance":0.025,"semanticRole":"neck_band","symmetry":null,"tessellation":{"targetEdgeLength":0.075}}],"parameters":{"armhole_depth":0.205,"back_neckline_depth":0.035,"body_ease":0.045,"front_neckline_depth":0.085,"garment_body_length":0.53469353,"half_chest_width":0.22,"hem_allowance":0.025,"neckband_length_ease_ratio":0.92,"neckband_width":0.035,"neckline_width":0.12,"shoulder_slope":0.035,"shoulder_width":0.7,"sleeve_cap_height":0.105,"sleeve_length":0.14,"sleeve_opening_width":0.18,"target_panel_edge_length":0.075},"provenance":{"generator":"closy.tshirt.pattern.v1","sourceKind":"procedural_fixture"},"schemaVersion":1,"seams":[{"attachmentOrder":10,"easeRatio":1.0,"id":"seam.shoulder.left","spans":[{"edgeId":"edge.shoulder.left.front","orientation":"forward","panelId":"panel.front"},{"edgeId":"edge.shoulder.left.back","orientation":"reverse","panelId":"panel.back"}],"stitchType":"lockstitch"},{"attachmentOrder":11,"easeRatio":1.0,"id":"seam.shoulder.right","spans":[{"edgeId":"edge.shoulder.right.front","orientation":"forward","panelId":"panel.front"},{"edgeId":"edge.shoulder.right.back","orientation":"reverse","panelId":"panel.back"}],"stitchType":"lockstitch"},{"attachmentOrder":20,"easeRatio":1.0,"id":"seam.side.left","spans":[{"edgeId":"edge.side.left.front","orientation":"forward","panelId":"panel.front"},{"edgeId":"edge.side.left.back","orientation":"reverse","panelId":"panel.back"}],"stitchType":"lockstitch"},{"attachmentOrder":21,"easeRatio":1.0,"id":"seam.side.right","spans":[{"edgeId":"edge.side.right.front","orientation":"forward","panelId":"panel.front"},{"edgeId":"edge.side.right.back","orientation":"reverse","panelId":"panel.back"}],"stitchType":"lockstitch"},{"attachmentOrder":30,"easeRatio":1.08,"id":"seam.armhole.left.front","spans":[{"edgeId":"edge.armhole.left.front","orientation":"forward","panelId":"panel.front"},{"edgeId":"edge.sleeve_cap.left","orientation":"forward","panelId":"panel.sleeve.left","partitionId":"sleeve_cap.left.front","sampleRange":[0,3]}],"stitchType":"lockstitch"},{"attachmentOrder":31,"easeRatio":1.08,"id":"seam.armhole.left.back","spans":[{"edgeId":"edge.armhole.left.back","orientation":"forward","panelId":"panel.back"},{"edgeId":"edge.sleeve_cap.left","orientation":"reverse","panelId":"panel.sleeve.left","partitionId":"sleeve_cap.left.back","sampleRange":[3,5]}],"stitchType":"lockstitch"},{"attachmentOrder":32,"easeRatio":1.08,"id":"seam.armhole.right.front","spans":[{"edgeId":"edge.armhole.right.front","orientation":"forward","panelId":"panel.front"},{"edgeId":"edge.sleeve_cap.right","orientation":"reverse","panelId":"panel.sleeve.right","partitionId":"sleeve_cap.right.front","sampleRange":[3,5]}],"stitchType":"lockstitch"},{"attachmentOrder":33,"easeRatio":1.08,"id":"seam.armhole.right.back","spans":[{"edgeId":"edge.armhole.right.back","orientation":"forward","panelId":"panel.back"},{"edgeId":"edge.sleeve_cap.right","orientation":"forward","panelId":"panel.sleeve.right","partitionId":"sleeve_cap.right.back","sampleRange":[0,3]}],"stitchType":"lockstitch"},{"attachmentOrder":40,"easeRatio":1.0,"id":"seam.sleeve_underarm.left","spans":[{"edgeId":"edge.sleeve_underarm.left.left","orientation":"forward","panelId":"panel.sleeve.left"},{"edgeId":"edge.sleeve_underarm.right.left","orientation":"reverse","panelId":"panel.sleeve.left"}],"stitchType":"lockstitch"},{"attachmentOrder":41,"easeRatio":1.0,"id":"seam.sleeve_underarm.right","spans":[{"edgeId":"edge.sleeve_underarm.left.right","orientation":"forward","panelId":"panel.sleeve.right"},{"edgeId":"edge.sleeve_underarm.right.right","orientation":"reverse","panelId":"panel.sleeve.right"}],"stitchType":"lockstitch"},{"attachmentOrder":50,"easeRatio":1.0,"id":"seam.neck_band.closure","simulationEnabled":false,"simulationStatus":"disabled_reference_solver_trim_closure_pending","spans":[{"edgeId":"edge.neck_band.short.left","orientation":"forward","panelId":"panel.neck_band"},{"edgeId":"edge.neck_band.short.right","orientation":"reverse","panelId":"panel.neck_band"}],"stitchType":"lockstitch"},{"attachmentOrder":51,"easeRatio":0.92,"id":"seam.neck_band.attachment","spans":[{"edgeId":"edge.neck.front","orientation":"forward","panelId":"panel.front"},{"edgeId":"edge.neck_band.long.bottom","orientation":"forward","panelId":"panel.neck_band","partiti